[
  {
    "document_id": "doc-intake-demo",
    "organization_id": "tenant-A",
    "document_type": "INTAKE_VOUCHER",
    "source_event_id": "event-intake-demo",
    "version": 1,
    "issued_at": "2026-09-08T14:30:00Z",
    "order_id": "OT-DEMO-154",
    "business_name": "Tecno Cell (demo)",
    "customer_name": "Laura Ejemplo",
    "snapshot": {
      "device": "Samsung Galaxy S24 - DEMO-001",
      "statement": "Recibido para diagnostico. No acredita pago ni entrega.",
      "received_at": "2026-09-08T14:30:00Z",
      "condition": "Rayon superficial en tapa",
      "accessories": [
        "Sin cargador"
      ],
      "receiver": "Asesor de demostracion"
    }
  },
  {
    "document_id": "doc-payment-demo",
    "organization_id": "tenant-A",
    "document_type": "PAYMENT_VOUCHER",
    "source_event_id": "event-payment-demo",
    "version": 1,
    "issued_at": "2026-09-08T22:45:00Z",
    "order_id": "OT-DEMO-154",
    "business_name": "Tecno Cell (demo)",
    "customer_name": "Laura Ejemplo",
    "snapshot": {
      "device": "Samsung Galaxy S24 - DEMO-001",
      "statement": "Pago total confirmado. No acredita entrega.",
      "currency": "COP",
      "total_minor": "35000000",
      "previous_paid_minor": "10000000",
      "this_payment_minor": "25000000",
      "balance_at_issue_minor": "0",
      "method": "CASH",
      "payment_id": "payment-final-demo"
    }
  }
]
